{
  "timestamp": 1778396324.8318393,
  "detected": false,
  "handedness": null,
  "confidence": null,
  "gesture_raw": "unknown",
  "gesture_stable": "unknown",
  "pinch_distance_norm": null,
  "hand_open_ratio": null,
  "finger_curl": {
    "thumb": null,
    "index": null,
    "middle": null,
    "ring": null,
    "little": null
  },
  "landmarks_2d": [],
  "landmarks_3d": [],
  "control_representation": {
    "valid": false,
    "features_valid": false,
    "command_ready": false,
    "source": null,
    "gesture_context": null,
    "preferred_mapping": null,
    "grasp_close": null,
    "thumb_index_proximity": null,
    "effective_pinch_strength": null,
    "pinch_strength": null,
    "support_flex": null,
    "finger_flex": {
      "thumb": null,
      "index": null,
      "middle": null,
      "ring": null,
      "little": null
    }
  },
  "control_ready": false,
  "svh_preview": {
    "enabled": false,
    "mode": "disabled",
    "valid": false,
    "command_source": null,
    "target_channels": [],
    "target_positions": [],
    "target_ticks_preview": [],
    "protocol_hint": {
      "set_control_state_addr": "0x09",
      "set_all_channels_addr": "0x03",
      "transport": "mock",
      "channel_layout": "compact5",
      "channel_order": "thumb,index,middle,ring,little",
      "position_units": "normalized_preview",
      "target_tick_units": "none"
    }
  },
  "frame_index": 573,
  "fps": 31.68226490188567,
  "latency_ms": 11.80729999759933
}